{
 "format": "scct.map-authoring",
 "version": 1,
 "map": "c:\\game\\packages\\mapsed\\testd.sdc",
 "level": "MyLevel",
 "actors": [
  {
   "actor": {
    "path": "MyLevel.PlayerStart0",
    "class": "Engine.PlayerStart"
   },
   "values": {
    "TeamNumber": "0",
    "Tag": "PlayerStart"
   },
   "schema": {},
   "unavailable": {},
   "selected": false,
   "position": [
    0,
    0,
    48
   ],
   "rotation": [
    0,
    16384,
    0
   ]
  },
  {
   "actor": {
    "path": "MyLevel.PlayerStart1",
    "class": "Engine.PlayerStart"
   },
   "values": {
    "TeamNumber": "1",
    "Tag": "MercSpawn"
   },
   "schema": {},
   "unavailable": {},
   "selected": false,
   "position": [
    512,
    0,
    48
   ],
   "rotation": [
    0,
    32768,
    0
   ]
  },
  {
   "actor": {
    "path": "MyLevel.SComputerObjectiveTrigger0",
    "class": "SBase.SComputerObjectiveTrigger"
   },
   "values": {
    "Tag": "Server",
    "TriggerName": "\"Main server\"",
    "DominationCaptureTime": "12.000000"
   },
   "schema": {},
   "unavailable": {},
   "selected": false,
   "position": [
    256,
    256,
    78
   ],
   "rotation": [
    0,
    0,
    0
   ]
  },
  {
   "actor": {
    "path": "MyLevel.SFlag0",
    "class": "SBase.SFlag"
   },
   "values": {
    "Tag": "SFlag",
    "ResetTime": "30.000000"
   },
   "schema": {},
   "unavailable": {},
   "selected": false,
   "position": [
    0,
    512,
    64
   ],
   "rotation": [
    0,
    0,
    0
   ]
  },
  {
   "actor": {
    "path": "MyLevel.SFlagDropZone0",
    "class": "SBase.SFlagDropZone"
   },
   "values": {
    "Tag": "SFlagDropZone"
   },
   "schema": {},
   "unavailable": {},
   "selected": false,
   "position": [
    100,
    600,
    64
   ],
   "rotation": [
    0,
    0,
    0
   ]
  },
  {
   "actor": {
    "path": "MyLevel.SCamNetwork0",
    "class": "SBase.SCamNetwork"
   },
   "values": {
    "Tag": "SCamNetwork",
    "bFirstCam": "True"
   },
   "schema": {},
   "unavailable": {},
   "selected": false,
   "position": [
    0,
    0,
    200
   ],
   "rotation": [
    0,
    49152,
    0
   ]
  },
  {
   "actor": {
    "path": "MyLevel.Light0",
    "class": "Engine.Light"
   },
   "values": {
    "Tag": "Light",
    "LightBrightness": "64.000000",
    "LightEffect": "LE_None"
   },
   "schema": {},
   "unavailable": {},
   "selected": false,
   "position": [
    0,
    0,
    300
   ],
   "rotation": [
    0,
    0,
    0
   ]
  },
  {
   "actor": {
    "path": "MyLevel.StaticMeshActor0",
    "class": "Engine.StaticMeshActor"
   },
   "values": {
    "Tag": "StaticMeshActor",
    "StaticMesh": "StaticMesh'Crates.Wood.Crate01'"
   },
   "schema": {},
   "unavailable": {},
   "selected": false,
   "position": [
    50,
    50,
    0
   ],
   "rotation": [
    0,
    0,
    0
   ]
  },
  {
   "actor": {
    "path": "MyLevel.SMission0",
    "class": "SBase.SMission"
   },
   "values": {
    "Tag": "SMission"
   },
   "schema": {},
   "unavailable": {},
   "selected": false,
   "position": [
    0,
    0,
    0
   ],
   "rotation": [
    0,
    0,
    0
   ]
  },
  {
   "actor": {
    "path": "MyLevel.Emitter3",
    "class": "SBase.SSpawnableEmitter"
   },
   "values": {
    "Tag": "Steam",
    "Emitters": [
     "SpriteEmitter'MyLevel.SpriteEmitter0'"
    ]
   },
   "schema": {},
   "unavailable": {},
   "selected": false,
   "position": [
    10,
    10,
    10
   ],
   "rotation": [
    0,
    0,
    0
   ]
  },
  {
   "actor": {
    "path": "MyLevel.SpriteEmitter0",
    "class": "Engine.SpriteEmitter"
   },
   "values": {},
   "schema": {},
   "unavailable": {}
  }
 ],
 "classes": [],
 "assets": {
  "Sound": [],
  "Material": [],
  "StaticMesh": []
 },
 "geometryT3d": "Begin Map\nBegin Actor Class=Brush Name=Brush5\n    CsgOper=CSG_Subtract\n    Location=(X=0.000000,Y=0.000000,Z=0.000000)\n    Begin Brush Name=Model5\n       Begin PolyList\n          Begin Polygon\n             Vertex   +00512.000000,-00512.000000,+00000.000000\n             Vertex   +00512.000000,+00768.000000,+00000.000000\n             Vertex   +00512.000000,+00768.000000,+00320.000000\n             Vertex   +00512.000000,-00512.000000,+00320.000000\n          End Polygon\n          Begin Polygon\n             Vertex   -00512.000000,-00512.000000,+00000.000000\n             Vertex   -00512.000000,-00512.000000,+00320.000000\n             Vertex   -00512.000000,+00768.000000,+00320.000000\n             Vertex   -00512.000000,+00768.000000,+00000.000000\n          End Polygon\n          Begin Polygon\n             Vertex   -00512.000000,+00768.000000,+00000.000000\n             Vertex   -00512.000000,+00768.000000,+00320.000000\n             Vertex   +00512.000000,+00768.000000,+00320.000000\n             Vertex   +00512.000000,+00768.000000,+00000.000000\n          End Polygon\n          Begin Polygon\n             Vertex   -00512.000000,-00512.000000,+00000.000000\n             Vertex   +00512.000000,-00512.000000,+00000.000000\n             Vertex   +00512.000000,-00512.000000,+00320.000000\n             Vertex   -00512.000000,-00512.000000,+00320.000000\n          End Polygon\n          Begin Polygon\n             Vertex   -00512.000000,-00512.000000,+00320.000000\n             Vertex   +00512.000000,-00512.000000,+00320.000000\n             Vertex   +00512.000000,+00768.000000,+00320.000000\n             Vertex   -00512.000000,+00768.000000,+00320.000000\n          End Polygon\n          Begin Polygon\n             Vertex   -00512.000000,-00512.000000,+00000.000000\n             Vertex   -00512.000000,+00768.000000,+00000.000000\n             Vertex   +00512.000000,+00768.000000,+00000.000000\n             Vertex   +00512.000000,-00512.000000,+00000.000000\n          End Polygon\n       End PolyList\n    End Brush\nEnd Actor\nEnd Map\n",
 "changes": {
  "format": "scct.map-changes",
  "version": 3,
  "map": "c:\\game\\packages\\mapsed\\testd.sdc",
  "description": "",
  "operations": []
 }
}